{
  "$schema": "https://raw.githubusercontent.com/hetalang/heta-compiler/v0.12.3/src/dynms/dynms.schema.json",
  "dynms": "0.2.2",
  "generator": {
    "name": "heta-compiler",
    "version": "0.12.3"
  },
  "created": "2026-10-19T03:14:15.612Z",
  "license": "UNLICENSED",
  "models": [
    {
      "id": "nameless",
      "constants": [
        {
          "id": "p1",
          "value": 1.5,
          "title": "p1"
        },
        {
          "id": "p2",
          "value": 0.05,
          "title": "p2"
        }
      ],
      "dynamic": [
        {
          "id": "S1_amt_",
          "initial": {
            "expr": [
              "Multiply",
              [
                "Divide",
                1,
                1
              ],
              1
            ],
            "format": "math-json"
          },
          "title": "S1",
          "derivative": {
            "expr": [
              "Negate",
              "reaction1"
            ],
            "format": "math-json"
          }
        },
        {
          "id": "S2_amt_",
          "initial": {
            "expr": [
              "Multiply",
              [
                "Divide",
                0,
                1
              ],
              1
            ],
            "format": "math-json"
          },
          "title": "S2",
          "derivative": {
            "expr": "reaction1",
            "format": "math-json"
          }
        }
      ],
      "static": [
        {
          "id": "compartment",
          "initial": 1,
          "title": "compartment"
        }
      ],
      "assignments": [
        {
          "id": "S2",
          "rhs": {
            "expr": [
              "Divide",
              "S2_amt_",
              "compartment"
            ],
            "format": "math-json"
          },
          "title": "S2"
        },
        {
          "id": "S1",
          "rhs": {
            "expr": [
              "Divide",
              "S1_amt_",
              "compartment"
            ],
            "format": "math-json"
          },
          "title": "S1"
        },
        {
          "id": "reaction1",
          "rhs": {
            "expr": [
              "Multiply",
              "S1",
              "compartment",
              [
                "If",
                "True",
                "p1",
                "p2"
              ]
            ],
            "format": "math-json"
          },
          "title": "reaction1"
        }
      ],
      "timeEvents": [],
      "events": [],
      "observables": []
    }
  ]
}