{
  "$schema": "https://raw.githubusercontent.com/hetalang/heta-compiler/v0.12.3/src/dynms/dynms.schema.json",
  "dynms": "0.2.2",
  "generator": {
    "name": "heta-compiler",
    "version": "0.12.3"
  },
  "created": "2026-10-13T12:57:29.498Z",
  "license": "UNLICENSED",
  "models": [
    {
      "id": "nameless",
      "constants": [
        {
          "id": "k1",
          "value": 1.5,
          "title": "k1"
        }
      ],
      "dynamic": [
        {
          "id": "S1_amt_",
          "initial": {
            "expr": [
              "Multiply",
              [
                "Divide",
                1.5,
                1
              ],
              1
            ],
            "format": "math-json"
          },
          "title": "S1",
          "derivative": {
            "expr": [
              "Negate",
              "reaction1"
            ],
            "format": "math-json"
          }
        },
        {
          "id": "S2_amt_",
          "initial": {
            "expr": [
              "Multiply",
              [
                "Divide",
                0,
                1
              ],
              1
            ],
            "format": "math-json"
          },
          "title": "S2",
          "derivative": {
            "expr": "reaction1",
            "format": "math-json"
          }
        },
        {
          "id": "S3_amt_",
          "initial": {
            "expr": [
              "Multiply",
              [
                "Divide",
                0,
                1
              ],
              1
            ],
            "format": "math-json"
          },
          "title": "S3",
          "derivative": {
            "expr": "S3_proc",
            "format": "math-json"
          }
        }
      ],
      "static": [
        {
          "id": "C",
          "initial": 1,
          "title": "C"
        }
      ],
      "assignments": [
        {
          "id": "S2",
          "rhs": {
            "expr": [
              "Divide",
              "S2_amt_",
              "C"
            ],
            "format": "math-json"
          },
          "title": "S2"
        },
        {
          "id": "S3",
          "rhs": {
            "expr": [
              "Divide",
              "S3_amt_",
              "C"
            ],
            "format": "math-json"
          },
          "title": "S3"
        },
        {
          "id": "S1",
          "rhs": {
            "expr": [
              "Divide",
              "S1_amt_",
              "C"
            ],
            "format": "math-json"
          },
          "title": "S1"
        },
        {
          "id": "reaction1",
          "rhs": {
            "expr": [
              "Multiply",
              "C",
              "k1",
              "S1"
            ],
            "format": "math-json"
          },
          "title": "reaction1"
        },
        {
          "id": "S3_proc",
          "rhs": {
            "expr": 0.15,
            "format": "math-json"
          }
        }
      ],
      "timeEvents": [],
      "events": [
        {
          "id": "event1",
          "trigger": {
            "type": "conditional",
            "rhs": {
              "expr": [
                "Less",
                "S1",
                0.1
              ],
              "format": "math-json"
            },
            "detection": "step"
          },
          "priority": 0,
          "actions": [
            {
              "rhs": {
                "expr": [
                  "Multiply",
                  1,
                  "C"
                ],
                "format": "math-json"
              },
              "state": "S2_amt_"
            }
          ],
          "active": true,
          "title": "event1"
        }
      ],
      "observables": []
    }
  ]
}