{
  "$schema": "https://raw.githubusercontent.com/hetalang/heta-compiler/v0.12.3/src/dynms/dynms.schema.json",
  "dynms": "0.2.2",
  "generator": {
    "name": "heta-compiler",
    "version": "0.12.3"
  },
  "created": "2026-10-22T13:10:10.868Z",
  "license": "UNLICENSED",
  "models": [
    {
      "id": "nameless",
      "constants": [],
      "dynamic": [],
      "static": [
        {
          "id": "C1",
          "initial": 0.5
        },
        {
          "id": "S1_amt_",
          "initial": {
            "expr": [
              "Multiply",
              2,
              0.5
            ],
            "format": "math-json"
          }
        }
      ],
      "assignments": [
        {
          "id": "S1",
          "rhs": {
            "expr": [
              "Divide",
              "S1_amt_",
              "C1"
            ],
            "format": "math-json"
          }
        },
        {
          "id": "x",
          "rhs": {
            "expr": "S1",
            "format": "math-json"
          }
        }
      ],
      "timeEvents": [],
      "events": [
        {
          "id": "E0",
          "trigger": {
            "type": "conditional",
            "rhs": {
              "expr": [
                "GreaterEqual",
                "t",
                0.45
              ],
              "format": "math-json"
            },
            "detection": "step"
          },
          "priority": 0,
          "actions": [
            {
              "rhs": {
                "expr": 0.2,
                "format": "math-json"
              },
              "state": "C1"
            },
            {
              "rhs": {
                "expr": [
                  "Multiply",
                  0.2,
                  "C1"
                ],
                "format": "math-json"
              },
              "state": "S1_amt_"
            }
          ],
          "active": true
        }
      ],
      "observables": []
    }
  ]
}