{
  "$schema": "https://raw.githubusercontent.com/hetalang/heta-compiler/v0.12.3/src/dynms/dynms.schema.json",
  "dynms": "0.2.2",
  "generator": {
    "name": "heta-compiler",
    "version": "0.12.3"
  },
  "created": "2026-10-26T11:50:53.712Z",
  "license": "UNLICENSED",
  "models": [
    {
      "id": "nameless",
      "constants": [
        {
          "id": "k1",
          "value": 0.75,
          "title": "k1"
        },
        {
          "id": "k2",
          "value": 0.25,
          "title": "k2"
        },
        {
          "id": "k3",
          "value": 0.8,
          "title": "k3"
        },
        {
          "id": "k4",
          "value": 0.2,
          "title": "k4"
        },
        {
          "id": "p1",
          "value": 0.5,
          "title": "p1"
        }
      ],
      "dynamic": [
        {
          "id": "S1_amt_",
          "initial": {
            "expr": [
              "Multiply",
              [
                "Add",
                "p1",
                "p1"
              ],
              1
            ],
            "format": "math-json"
          },
          "title": "S1",
          "derivative": {
            "expr": [
              "Add",
              [
                "Negate",
                "reaction1"
              ],
              "reaction2"
            ],
            "format": "math-json"
          }
        },
        {
          "id": "S2_amt_",
          "initial": {
            "expr": [
              "Multiply",
              [
                "Divide",
                2,
                1
              ],
              1
            ],
            "format": "math-json"
          },
          "title": "S2",
          "derivative": {
            "expr": [
              "Add",
              [
                "Negate",
                "reaction1"
              ],
              "reaction2"
            ],
            "format": "math-json"
          }
        },
        {
          "id": "S3_amt_",
          "initial": {
            "expr": [
              "Multiply",
              [
                "Divide",
                1,
                1
              ],
              1
            ],
            "format": "math-json"
          },
          "title": "S3",
          "derivative": {
            "expr": [
              "Add",
              "reaction1",
              [
                "Negate",
                "reaction2"
              ]
            ],
            "format": "math-json"
          }
        }
      ],
      "static": [
        {
          "id": "C",
          "initial": 1,
          "title": "C"
        }
      ],
      "assignments": [
        {
          "id": "S1",
          "rhs": {
            "expr": [
              "Divide",
              "S1_amt_",
              "C"
            ],
            "format": "math-json"
          },
          "title": "S1"
        },
        {
          "id": "S2",
          "rhs": {
            "expr": [
              "Divide",
              "S2_amt_",
              "C"
            ],
            "format": "math-json"
          },
          "title": "S2"
        },
        {
          "id": "reaction1",
          "rhs": {
            "expr": [
              "Multiply",
              "C",
              "k1",
              "S1",
              "S2"
            ],
            "format": "math-json"
          },
          "title": "reaction1"
        },
        {
          "id": "S3",
          "rhs": {
            "expr": [
              "Divide",
              "S3_amt_",
              "C"
            ],
            "format": "math-json"
          },
          "title": "S3"
        },
        {
          "id": "reaction2",
          "rhs": {
            "expr": [
              "Multiply",
              "C",
              "k2",
              "S3"
            ],
            "format": "math-json"
          },
          "title": "reaction2"
        }
      ],
      "timeEvents": [],
      "events": [
        {
          "id": "event1",
          "trigger": {
            "type": "conditional",
            "rhs": {
              "expr": [
                "Less",
                "S1",
                0.5
              ],
              "format": "math-json"
            },
            "detection": "step"
          },
          "priority": 0,
          "actions": [
            {
              "rhs": {
                "expr": [
                  "Multiply",
                  [
                    "Add",
                    "k3",
                    "k4"
                  ],
                  "C"
                ],
                "format": "math-json"
              },
              "state": "S2_amt_"
            }
          ],
          "active": true,
          "title": "event1"
        }
      ],
      "observables": []
    }
  ]
}