{
  "$schema": "https://raw.githubusercontent.com/hetalang/heta-compiler/v0.12.3/src/dynms/dynms.schema.json",
  "dynms": "0.2.2",
  "generator": {
    "name": "heta-compiler",
    "version": "0.12.3"
  },
  "created": "2026-10-26T12:00:01.106Z",
  "license": "UNLICENSED",
  "models": [
    {
      "id": "nameless",
      "constants": [],
      "dynamic": [
        {
          "id": "S1_amt_",
          "initial": {
            "expr": [
              "Multiply",
              1.5,
              1.75
            ],
            "format": "math-json"
          },
          "title": "S1",
          "derivative": {
            "expr": [
              "Negate",
              "reaction1"
            ],
            "format": "math-json"
          }
        },
        {
          "id": "S2_amt_",
          "initial": {
            "expr": [
              "Multiply",
              0,
              1.75
            ],
            "format": "math-json"
          },
          "title": "S2",
          "derivative": {
            "expr": "reaction1",
            "format": "math-json"
          }
        },
        {
          "id": "S3_amt_",
          "initial": {
            "expr": [
              "Multiply",
              0,
              1.75
            ],
            "format": "math-json"
          },
          "title": "S3",
          "derivative": {
            "expr": "S3_proc",
            "format": "math-json"
          }
        }
      ],
      "static": [
        {
          "id": "C",
          "initial": 1.75,
          "title": "C"
        },
        {
          "id": "k1",
          "initial": 1.5,
          "title": "k1"
        }
      ],
      "assignments": [
        {
          "id": "S2",
          "rhs": {
            "expr": [
              "Divide",
              "S2_amt_",
              "C"
            ],
            "format": "math-json"
          },
          "title": "S2"
        },
        {
          "id": "S3",
          "rhs": {
            "expr": [
              "Divide",
              "S3_amt_",
              "C"
            ],
            "format": "math-json"
          },
          "title": "S3"
        },
        {
          "id": "S1",
          "rhs": {
            "expr": [
              "Divide",
              "S1_amt_",
              "C"
            ],
            "format": "math-json"
          },
          "title": "S1"
        },
        {
          "id": "reaction1",
          "rhs": {
            "expr": [
              "Multiply",
              "C",
              "k1",
              "S1"
            ],
            "format": "math-json"
          },
          "title": "reaction1"
        },
        {
          "id": "S3_proc",
          "rhs": {
            "expr": 0.15,
            "format": "math-json"
          }
        }
      ],
      "timeEvents": [],
      "events": [],
      "observables": []
    }
  ]
}