{
  "$schema": "https://raw.githubusercontent.com/hetalang/heta-compiler/v0.12.3/src/dynms/dynms.schema.json",
  "dynms": "0.2.2",
  "generator": {
    "name": "heta-compiler",
    "version": "0.12.3"
  },
  "created": "2026-10-22T13:43:31.172Z",
  "license": "UNLICENSED",
  "models": [
    {
      "id": "nameless",
      "constants": [
        {
          "id": "timeconv",
          "value": 60
        },
        {
          "id": "t3",
          "value": 1
        }
      ],
      "dynamic": [],
      "static": [
        {
          "id": "t4",
          "initial": 1
        }
      ],
      "assignments": [],
      "timeEvents": [],
      "events": [],
      "observables": []
    }
  ]
}