{
  "$schema": "https://raw.githubusercontent.com/hetalang/heta-compiler/v0.12.3/src/dynms/dynms.schema.json",
  "dynms": "0.2.2",
  "generator": {
    "name": "heta-compiler",
    "version": "0.12.3"
  },
  "created": "2026-10-22T16:05:03.893Z",
  "license": "UNLICENSED",
  "models": [
    {
      "id": "nameless",
      "constants": [
        {
          "id": "k1",
          "value": 0.015,
          "title": "k1"
        },
        {
          "id": "k2",
          "value": 0.5,
          "title": "k2"
        },
        {
          "id": "k3",
          "value": 1.5,
          "title": "k3"
        }
      ],
      "dynamic": [
        {
          "id": "S1_amt_",
          "initial": {
            "expr": [
              "Multiply",
              [
                "Divide",
                0.00001,
                1.4
              ],
              1.4
            ],
            "format": "math-json"
          },
          "title": "S1",
          "derivative": {
            "expr": [
              "Add",
              [
                "Negate",
                "reaction1"
              ],
              "reaction2"
            ],
            "format": "math-json"
          }
        },
        {
          "id": "S2_amt_",
          "initial": {
            "expr": [
              "Multiply",
              [
                "Divide",
                0.000015,
                1.4
              ],
              1.4
            ],
            "format": "math-json"
          },
          "title": "S2",
          "derivative": {
            "expr": "S2_proc",
            "format": "math-json"
          }
        },
        {
          "id": "S3_amt_",
          "initial": {
            "expr": [
              "Multiply",
              [
                "Divide",
                0.00001,
                1.4
              ],
              1.4
            ],
            "format": "math-json"
          },
          "title": "S3",
          "derivative": {
            "expr": [
              "Add",
              "reaction1",
              [
                "Negate",
                "reaction2"
              ]
            ],
            "format": "math-json"
          }
        }
      ],
      "static": [
        {
          "id": "C",
          "initial": 1.4,
          "title": "C"
        }
      ],
      "assignments": [
        {
          "id": "S2",
          "rhs": {
            "expr": [
              "Divide",
              "S2_amt_",
              "C"
            ],
            "format": "math-json"
          },
          "title": "S2"
        },
        {
          "id": "S1",
          "rhs": {
            "expr": [
              "Divide",
              "S1_amt_",
              "C"
            ],
            "format": "math-json"
          },
          "title": "S1"
        },
        {
          "id": "S4",
          "rhs": {
            "expr": [
              "Multiply",
              "k3",
              "S1"
            ],
            "format": "math-json"
          },
          "title": "S4"
        },
        {
          "id": "reaction1",
          "rhs": {
            "expr": [
              "Multiply",
              "C",
              "k1",
              "S1"
            ],
            "format": "math-json"
          },
          "title": "reaction1"
        },
        {
          "id": "S3",
          "rhs": {
            "expr": [
              "Divide",
              "S3_amt_",
              "C"
            ],
            "format": "math-json"
          },
          "title": "S3"
        },
        {
          "id": "reaction2",
          "rhs": {
            "expr": [
              "Multiply",
              "C",
              "k2",
              "S3"
            ],
            "format": "math-json"
          },
          "title": "reaction2"
        },
        {
          "id": "S2_proc",
          "rhs": {
            "expr": [
              "Add",
              [
                "Multiply",
                "k2",
                "S3"
              ],
              [
                "Multiply",
                -1,
                "k1",
                "S1"
              ]
            ],
            "format": "math-json"
          }
        }
      ],
      "timeEvents": [],
      "events": [],
      "observables": []
    }
  ]
}