{
  "$schema": "https://raw.githubusercontent.com/hetalang/heta-compiler/v0.12.3/src/dynms/dynms.schema.json",
  "dynms": "0.2.2",
  "generator": {
    "name": "heta-compiler",
    "version": "0.12.3"
  },
  "created": "2026-10-22T13:43:34.007Z",
  "license": "UNLICENSED",
  "models": [
    {
      "id": "nameless",
      "constants": [
        {
          "id": "extentconv",
          "value": 1000
        },
        {
          "id": "timeconv",
          "value": 60
        }
      ],
      "dynamic": [
        {
          "id": "s1",
          "initial": 1,
          "derivative": {
            "expr": "J0",
            "format": "math-json"
          }
        }
      ],
      "static": [
        {
          "id": "C",
          "initial": 1
        }
      ],
      "assignments": [
        {
          "id": "J0",
          "rhs": {
            "expr": 10,
            "format": "math-json"
          }
        }
      ],
      "timeEvents": [],
      "events": [],
      "observables": []
    }
  ]
}