{
  "$schema": "https://raw.githubusercontent.com/hetalang/heta-compiler/v0.12.3/src/dynms/dynms.schema.json",
  "dynms": "0.2.2",
  "generator": {
    "name": "heta-compiler",
    "version": "0.12.3"
  },
  "created": "2026-10-26T12:02:00.881Z",
  "license": "UNLICENSED",
  "models": [
    {
      "id": "nameless",
      "constants": [],
      "dynamic": [
        {
          "id": "S1",
          "initial": {
            "expr": [
              "Multiply",
              0.6,
              2
            ],
            "format": "math-json"
          },
          "derivative": {
            "expr": "S1_proc",
            "format": "math-json"
          }
        }
      ],
      "static": [
        {
          "id": "c",
          "initial": 2
        }
      ],
      "assignments": [
        {
          "id": "S1_proc",
          "rhs": {
            "expr": 1,
            "format": "math-json"
          }
        }
      ],
      "timeEvents": [],
      "events": [],
      "observables": []
    }
  ]
}