{
  "$schema": "https://raw.githubusercontent.com/hetalang/heta-compiler/v0.12.3/src/dynms/dynms.schema.json",
  "dynms": "0.2.2",
  "generator": {
    "name": "heta-compiler",
    "version": "0.12.3"
  },
  "created": "2026-10-13T12:56:16.102Z",
  "license": "UNLICENSED",
  "models": [
    {
      "id": "nameless",
      "constants": [
        {
          "id": "k1",
          "value": 0.75,
          "title": "k1"
        },
        {
          "id": "k2",
          "value": 0.25,
          "title": "k2"
        },
        {
          "id": "p1",
          "value": 0.25,
          "title": "p1"
        }
      ],
      "dynamic": [
        {
          "id": "S1_amt_",
          "initial": {
            "expr": [
              "Multiply",
              [
                "Divide",
                0.001,
                [
                  "Multiply",
                  2,
                  "p1"
                ]
              ],
              2,
              "p1"
            ],
            "format": "math-json"
          },
          "title": "S1",
          "derivative": {
            "expr": [
              "Add",
              [
                "Negate",
                "reaction1"
              ],
              "reaction2"
            ],
            "format": "math-json"
          }
        },
        {
          "id": "S2_amt_",
          "initial": {
            "expr": [
              "Multiply",
              [
                "Divide",
                0.002,
                [
                  "Multiply",
                  2,
                  "p1"
                ]
              ],
              2,
              "p1"
            ],
            "format": "math-json"
          },
          "title": "S2",
          "derivative": {
            "expr": [
              "Add",
              [
                "Negate",
                "reaction1"
              ],
              "reaction2"
            ],
            "format": "math-json"
          }
        },
        {
          "id": "S3_amt_",
          "initial": {
            "expr": [
              "Multiply",
              [
                "Divide",
                0.001,
                [
                  "Multiply",
                  2,
                  "p1"
                ]
              ],
              2,
              "p1"
            ],
            "format": "math-json"
          },
          "title": "S3",
          "derivative": {
            "expr": [
              "Add",
              "reaction1",
              [
                "Negate",
                "reaction2"
              ]
            ],
            "format": "math-json"
          }
        }
      ],
      "static": [
        {
          "id": "C",
          "initial": {
            "expr": [
              "Multiply",
              2,
              "p1"
            ],
            "format": "math-json"
          },
          "title": "C"
        }
      ],
      "assignments": [
        {
          "id": "S1",
          "rhs": {
            "expr": [
              "Divide",
              "S1_amt_",
              "C"
            ],
            "format": "math-json"
          },
          "title": "S1"
        },
        {
          "id": "S2",
          "rhs": {
            "expr": [
              "Divide",
              "S2_amt_",
              "C"
            ],
            "format": "math-json"
          },
          "title": "S2"
        },
        {
          "id": "reaction1",
          "rhs": {
            "expr": [
              "Multiply",
              "C",
              "k1",
              "S1",
              "S2"
            ],
            "format": "math-json"
          },
          "title": "reaction1"
        },
        {
          "id": "S3",
          "rhs": {
            "expr": [
              "Divide",
              "S3_amt_",
              "C"
            ],
            "format": "math-json"
          },
          "title": "S3"
        },
        {
          "id": "reaction2",
          "rhs": {
            "expr": [
              "Multiply",
              "C",
              "k2",
              "S3"
            ],
            "format": "math-json"
          },
          "title": "reaction2"
        }
      ],
      "timeEvents": [],
      "events": [],
      "observables": []
    }
  ]
}