{
  "$schema": "https://raw.githubusercontent.com/hetalang/heta-compiler/v0.12.3/src/dynms/dynms.schema.json",
  "dynms": "0.2.2",
  "generator": {
    "name": "heta-compiler",
    "version": "0.12.3"
  },
  "created": "2026-10-26T11:47:14.629Z",
  "license": "UNLICENSED",
  "models": [
    {
      "id": "nameless",
      "constants": [
        {
          "id": "k1",
          "value": 1.5,
          "title": "k1"
        }
      ],
      "dynamic": [
        {
          "id": "S1",
          "initial": 0.0015,
          "title": "S1",
          "derivative": {
            "expr": [
              "Negate",
              "reaction1"
            ],
            "format": "math-json"
          }
        },
        {
          "id": "S2",
          "initial": 0,
          "title": "S2",
          "derivative": {
            "expr": "reaction1",
            "format": "math-json"
          }
        }
      ],
      "static": [
        {
          "id": "compartment",
          "initial": 1,
          "title": "compartment"
        }
      ],
      "assignments": [
        {
          "id": "reaction1",
          "rhs": {
            "expr": [
              "Multiply",
              "k1",
              "S1"
            ],
            "format": "math-json"
          },
          "title": "reaction1"
        }
      ],
      "timeEvents": [],
      "events": [],
      "observables": []
    }
  ]
}