{
  "$schema": "https://raw.githubusercontent.com/hetalang/heta-compiler/v0.12.3/src/dynms/dynms.schema.json",
  "dynms": "0.2.2",
  "generator": {
    "name": "heta-compiler",
    "version": "0.12.3"
  },
  "created": "2026-10-22T16:07:06.016Z",
  "license": "UNLICENSED",
  "models": [
    {
      "id": "nameless",
      "constants": [],
      "dynamic": [
        {
          "id": "c",
          "initial": {
            "expr": [
              "Divide",
              3,
              2
            ],
            "format": "math-json"
          },
          "title": "c",
          "derivative": {
            "expr": "c_proc",
            "format": "math-json"
          }
        }
      ],
      "static": [],
      "assignments": [
        {
          "id": "c_proc",
          "rhs": {
            "expr": [
              "Multiply",
              0.25,
              "c"
            ],
            "format": "math-json"
          }
        }
      ],
      "timeEvents": [],
      "events": [],
      "observables": []
    }
  ]
}