{
  "$schema": "https://raw.githubusercontent.com/hetalang/heta-compiler/v0.12.3/src/dynms/dynms.schema.json",
  "dynms": "0.2.2",
  "generator": {
    "name": "heta-compiler",
    "version": "0.12.3"
  },
  "created": "2026-10-22T19:58:50.209Z",
  "license": "UNLICENSED",
  "models": [
    {
      "id": "nameless",
      "constants": [],
      "dynamic": [
        {
          "id": "S1",
          "initial": 0.1,
          "title": "S1",
          "derivative": {
            "expr": [
              "Negate",
              "reaction1"
            ],
            "format": "math-json"
          }
        },
        {
          "id": "S2",
          "initial": 0.15,
          "title": "S2",
          "derivative": {
            "expr": "reaction1",
            "format": "math-json"
          }
        }
      ],
      "static": [
        {
          "id": "compartment",
          "initial": 10,
          "title": "compartment"
        },
        {
          "id": "k1",
          "initial": 1.05,
          "title": "k1"
        },
        {
          "id": "k2",
          "initial": 1.15,
          "title": "k2"
        }
      ],
      "assignments": [
        {
          "id": "S3",
          "rhs": {
            "expr": [
              "Multiply",
              "k1",
              "S2"
            ],
            "format": "math-json"
          },
          "title": "S3"
        },
        {
          "id": "reaction1",
          "rhs": {
            "expr": [
              "Multiply",
              "k2",
              "S1"
            ],
            "format": "math-json"
          },
          "title": "reaction1"
        }
      ],
      "timeEvents": [],
      "events": [],
      "observables": []
    }
  ]
}